text,language
"தொல்பழங்காலம் அறிவியல் தன் முதல்நிலைப் பொருளில் அறிவின் ஒருவகையைக் குறித்ததே தவிர, அத்தகைய அறிவின் தேட்டத்துக்கான சிறப்பு சொல்லாக அமைந்திலது.",Tamil
"குறிப்பாக, இது மக்கள் ஒருவருக்கொருவர் பரிமாறிப் பகிரும் வகைப்பட்ட அறிவாக இலங்கியது.",Tamil
"எடுத்துகாட்டாக,இயற்கைப் பொருள்களின் இயக்கம் பற்றீய செயல்பாட்டு அறிவாகவரலாறெழிதியல் காலத்துக்கு முன்பே திரண்டு சிக்கலான நுண்சிந்தனை வளர்ச்சிக்கு வழிவகுத்திருந்தது.",Tamil
"இது சிக்கலான நாட்காட்டிகளின் உருவாக்கம், நஞ்சுப்பொருள்களை உண்பொருள்களாக மாற்றும் நுட்பங்கள், சிக்கலான கூம்புகோபுரங்களின் கட்டுமானம் ஆகியவற்றின்வழி தெளிவாகிறது.",Tamil
"என்றாலும், இவை சார்ந்த அறிவின் தனித்தன்மை தெளிவாக தன்னுணர்வோடு வரையறுக்கப்படவில்லை.",Tamil
இவ்வுண்மை ஒவ்வொரு நாகரிகத்துக்கும் பொருந்தும்.,Tamil
"இவை மற்ற வகை அறிவுவகைகளான தொன்மங்கள், சட்ட நடைமுறைகளில் இருந்து வேறுபட்டிருந்தன.",Tamil
"அறிவியல் வழிமுறை என்று கருதப்பட, அவ்வழிமுறை பின்வரும் கூறுகளின் அடிப்படையில் அமையவேண்டும்.",Tamil
அறிவியல் முறை மீள்நிகழ்திற வழியில் இயற்கையின் நிகழ்ச்சிகளை விளக்குவதற்கு முயல்கிறது.,Tamil
ஒரு விளக்கச் சிந்தனைச் செய்முறை அல்லது கருதுகோள் ஒக்காம் அலகு நெறிமுறையைப் பயன்படுத்தி ஒரு விளக்கமாக முன்வைக்கப்படும்.,Tamil
இது பொதுவாக அந்நிகழ்வுக்கான பிற  ஏற்புடைய உண்மைகளோடு பொருந்தும் என எதிர்பார்க்கப்படுகிறது.,Tamil
முன்கணிப்பின் மெய்ப்பிக்க இயலாமை ஆய்வு நன்றாக முன்னேறுகிறது என்பதற்குச் சான்றாக அமையும்.,Tamil
உண்மையினை அடைகிறது.,Tamil
"மேலும், முதல்-விளைவு (காரணக் காரிய) உறவை நிறுவவும், ஒப்புறவுப் பிழையைத் தவிர்க்கவும் அறிவியல் நிறுவலுக்கு செய்முறை மிகவும் இன்றியமையாததாகும்]]).",Tamil
ஒரு கருதுகோள் நிறைவாக அமையவில்லியெனில் அது திருத்தப்படும் அல்லது மறுக்கப்படும்.,Tamil
"கருதுகோள் ஓர்வில் (சோதிப்பில்) வென்றால், அது அற்வியல் கோட்பாடாக ஏற்கப்படும்.",Tamil
"அதாவது, இது குறிப்பிட்ட இயற்கை நிகழ்வின் நடத்தையை அளவையியலாகவும் தன்னிறைவாகவும் விளக்கும் படிமமாக ஏற்கப்படும்.",Tamil
"கோட்பாடு கருதுகோளைவிட மிகப்பரந்த நிகழ்வின் கணங்களை விவரிக்கும்; வழக்கமாக, ஒரு கோட்பாட்டில் இருந்து அதற்கு இயைவான அல்லது கட்டுண்ட பல கருதுகோள்களை அளவையியலாகக் கொணரலாம்.",Tamil
எனவே ஒரு கோட்பாடு எனும் கருதுகோள் வேறு பல கருதுகோள்களை விளக்கவல்ல கருதுகோளாகும்.,Tamil
"கருதுகோள்களை நிறுவிட செய்முறைகளை மேற்கொள்ளும்போது, ஏதோ ஒரு விளைவை விரும்பும் போக்கு அமைய வாய்ப்புள்ளதால், ஒட்டுமொத்தமாக இவ்வகைச் சார்பை நீக்குவதை உறுதிபடுத்தல் முதன்மையானதாகும்.",Tamil
அறிவியல் ஆராய்ச்சிகளினால் தோன்றிய நடைமுறை விளைவுகள் அடிப்படை அறிவியல் கண்டுபிடிப்புகளால் உலகை மாற்றி அமைக்க இயலும்.,Tamil
"அறிவியல் முறை,அறிவியல் களஞ்சியம், தொகுதி 2, தமிழ்ப்பல்கலைக்கழகம், தஞ்சாவூர்.",Tamil
"அறிவியலின் முறையியல், சமூக விஞ்ஞானம், காலாண்டு ஆய்விதழ், தொகுதி ஒன்று.",Tamil
"இதழ் 3, தென்னக ஆய்வு மையம், இராயப்பேட்டை, சென்னை-17.",Tamil
"அறிவியலின் வரலாறெழுதியல், சமூக விஞ்ஞானம், காலாண்டு ஆய்விதழ், தொகுதி 9, இதழ்கள் 33-36, தென்னக ஆய்வு மையம், இராயப்பேட்டை, சென்னை-17.",Tamil
"வெளி இணைப்புகள் வெளியீடுகள் ""GCSE Science textbook"".",Tamil
"Wikibooks.org தகவல் வாயில்கள் Euroscience: ""ESOF: Euroscience Open Forum"".",Tamil
"Archived from the original on June 10, 2010.",Tamil
Science Development in the Latin American docta Classification of the Sciences in Dictionary of the History of Ideas.,Tamil
"(Dictionary's new electronic format is badly botched, entries after ""Design"" are inaccessible.",Tamil
Internet Archive old version).,Tamil
தொழினுட்பம் என்பது பொருட்கள் அல்லது சேவைகள் உற்பத்தி செய்ய பயன்படும் அறிவியல் நுட்பங்களின் தொகுப்பு.,Tamil
எனினும் ஓர் இறுக்கமான வரைவிலக்கணம் இதற்குக் கொடுக்க முடியாது.,Tamil
"தொழினுட்பம் பொறிகள், வன்பொருட்கள், பயன்பாட்டுப் பொருட்கள் போன்ற மனித இனத்துக்குப் பயன்படும் பொருள்களைக் குறிக்கக்கூடும்.",Tamil
"ஆனால் இது இன்னும் பரந்த முறைமைகள், அமைப்பு முறைகள், நுட்பங்கள் என்பவற்றையும் குறிக்கக்கூடும்.",Tamil
"இச் சொல்லைப் பொதுப் பொருளில் ஆள்வதுடன், குறிப்பிட்ட துறைகள் சார்பாகவும் பயன்படுத்தலாம்.",Tamil
"எடுத்துக்காட்டாக, கட்டுமானத் தொழினுட்பம், உயிர்மருத்துவப் பொறியியல் போன்ற பயன்பாடுகள் குறிப்பிட்ட துறைகள் சார்ந்தவையாகும்.",Tamil
"இவை தவிர பல நன்மைகளும் உண்டு அறிவியலும் பொறியியலும் தொழில்நுட்பமும் அறிவியல், பொறியியல்,  தொழினுட்பம் ஆகிய இம்மூன்றும் ஒன்றுக்கொண்று நெருங்கிய தொடர்பு கொண்டிருந்தாலும், இம்மூன்றும் வெவ்வேறானவை.",Tamil
இவற்றிற்கிடையே வேறுபாட்டைத் தெளிவாக வரையறுக்கமுடியாது எனினும் தோராயமாக நாம் இவற்றிற்கிடையேயுள்ள வேறுபாட்டை அறியலாம்.,Tamil
தியோடர் வோன் கர்மான் கூற்றின்படி:'அறிவியல் என்பது இவ்வுலகம் எப்படி இருக்கிறது/உருவானது என்பதை விளக்குகிறது; பொறியியல் என்பது இதுவரை இல்லாத உலகை/பொருளை/செயல்முறையை உருவாக்குகிறது.,Tamil
"தொழினுட்பம் என்பது பொறியியல் கருவிகள், ஆய்கருவிகள் போன்றவற்றை எப்படி செயல்படுத்துவது/பயன்படுத்துவது மற்றும் அதன் செயல்முறைகள் அனைத்தையும் உள்ளடக்கியது'.",Tamil
தொழினுட்பம் என்ற சொற்றொடர் ஒப்புமை அளிக்கப்பட்ட அனைத்துவிதமான பொறியியல் கருவிகள்/செயல்முறைகளைத் திரும்ப திரும்ப பயன்படுத்தலின் மூலமாக உருவாகிறது.,Tamil
"தொழினுட்பம் புதிதாக கண்டறியப்பட்ட பொருளை அறிவியல், பொறியியல் நுட்பத்தின் உதவி கொண்டு பேரளவில் உற்பத்தி செய்கின்றனர்.",Tamil
அப்போது மனித மூளை இன்றைய மனித் மூளையைப் போல மூன்றில் ஒருபங்காக அமைந்திருந்த்து.,Tamil
மிக் முந்திய மாந்த வரலாறு முழுவ்தும் கருவிப் பயன்பாடு ஓரளவு மாறாமலே இருந்தது.,Tamil
"தோராயமாக இமு 50,000 ஆண்டளவில் புதிய கருவிப் பயன்பாடும் புதிய நடத்தைத் தொகுதியும் மாந்தரினத்தில் முகிழ்த்தன.",Tamil
தொல்லியலாளர்கள் இதை மொழியின் தோற்றத்தோடு இணைக்கின்றனர்.,Tamil
கற்கருவிகள் பல மில்லியன் ஆண்டுகளுக்கு முன்பே முன்மாந்தவினம் (hominids) முதனிலைக் கற்கருவிகளைப் பயன்கொள்ளத் தொடஙிவிட்டது.,Tamil
"மிக முந்திய கருவிகள் பிளவுண்ட பாறைத்துண்டுகள் போலவே அமைந்தன, but approximately 75,000 ஆண்டுகளுக்கு  முன்பு உருவாகிய அழுத்தமுறைப் பிளப்பு கூரிய முனை வாய்ந்த திறமை கூடிய கோடரிகளை உருவாக்க வழிவகுத்தது.",Tamil
"தீயின் கையாளல் தீயின் கண்டுபிடிப்பும் பயன்பாடும் பல அரிய பணிகளுக்கான ஆற்றலாக ம்ட்டுமன்றி, மாந்தரினத் தொழில்நுட்ப்ப் படிமலர்ச்சியில் மாபெரும் திருப்புமுனையாகவும் அமைந்தது.",Tamil
"மரம், கரி எரித்து உருவாக்கிய தீ மனிதர் உணவு சமைக்க உதவியது.",Tamil
இதனால் செரிமானத் திறனும் ஊட்டச்சத்துகளும் கூடியதோடு பலவகை உணவுகளை உண்ண வாய்ப்பளித்தது.,Tamil
உடையும் உறையுளும் பழைய கற்கால ஊழியில் நிகழ்ந்த அடுத்த தொழில்நுட்ப முன்னேற்றங்களாக உடையும் உறையுளும் அமைகின்றன;  இவற்றை உருவாக்கிய சரியான நாளைக் குறிப்பிட முடியவில்லை.,Tamil
"ஆனால், இவை மாந்த முன்னேற்றத்துக்கு மிகவும் இன்றியமையாதனவாகும்.",Tamil
பழைய கற்காலம் முன்னேற முன்னேற வாழிடங்கள் நுட்பமாகவும் விரிவாகவும் அமையலாயின;  இமு 3.8 இலட்சம் ஆண்டுகள் அளவிலேயே தற்கலிக மரக்குடில்களை கட்டியுள்ளனர்.,Tamil
விலங்குகளின் மென்முடிகளிலும் வேட்டை விலங்குகளின் தோலிலும் செய்த உடைகள் மாந்தனுக்கு கடுங்குளிரிலும் வாழும் வாய்ப்புகளை உருவாக்கித் தந்தன; உலகின் பலபகுதிகளுக்கு மாந்தர் புலம்பெயர தொடங்கினர்.,Tamil
இமு 2 இலட்சம் ஆண்டுகள் அளவில் மாந்தர் ஆப்பிரிக்காவில் இருந்து வெளியேறி ஐரோப்பாசியா போன்ற பிற கண்டங்களுக்குச் செல்லத் தொடங்கினர்.,Tamil
"புதிய கற்காலத்தின் ஊடாக செவ்வியல் பழங்காலத்துக்கு (கிமு 8,000– கிபி 300) மாந்தத் தொழில்நுடப எழுச்சி உண்மையாக புதிய கற்காலத்தில் தான் களம்கண்டது.",Tamil
மெருகூட்டிய கற்கோடரி உருவாக்கம் மாபெரும் முண்ணேற்றமாகும்.,Tamil
இது காடழித்து வேளாண் நிலத்தை விரிவாக்கியது.,Tamil
இந்த மெருகூட்டிய கற்கோடரி புதிய கற்காலத்தில் பேறளவில் செய்யப்பட்டாலும் இதுஇடைக்கலத்தில் அயர்லாந்து போன்ற தொல்லியற் களங்களில் தோன்றியதாகும்.,Tamil
"வேளாண்மை பெருந்திரளான மக்கள்தொகைக்கு உணவூட்டி, ஓய்வு வாழ்க்கையையும் உருவாக்கியது.",Tamil
மக்கள் நாடோடி வாழ்க்கையைப் போல தோளில் தூக்கிச் செல்லவேண்டிய தேவை மறைந்தது.,Tamil
இளஞ்சிறார்களின் எண்ணிக்கை பெருகியது.,Tamil
வேட்டை-திர்ட்டல் பொருளியல்  குழந்தைகள் வேட்டையிலோ உணவு திரட்டலிலோ ஈடுபட முடியாது.,Tamil
"ஆனால், வேளாண் கட்டத்தில் பயிரிடுவதில் அவர்கள் எளிதாக உழைக்க முடிந்தது.",Tamil
"மக்கள் தொகை கூடி, உழைப்பில் ஈடுபடுவோர் எண்ணிக்கை கூடியதால்.",Tamil
உழைப்பில் வேலைப்பிரிவினை உருவாகியது.,Tamil
"கல், எலும்பு, மரத்தால் ஆன கருவிகளைவிட செம்புக் கருகளின் மேம்பாட்டை தொடக்கநிலை மாந்தர் உணரலாயினர்.",Tamil
இவ்வாறு தயகத்திலேயே செம்பு புதிய கற்காலத் தொடக்கத்தில் பத்தாயிரம் ஆண்டுகளுக்கு முன்னரே பயன்படலானது.,Tamil
தூய செம்பு பேரளவில் கிடைக்கவில்லை.,Tamil
"ஆனால், செம்புக் கனிமங்கள் எங்கும் கிடைத்தன்.",Tamil
"அவற்ரை மரம், கரி கொண்டு எரித்து எளிதாக தூய செம்பு பெறமுடிந்தது.",Tamil
"படிபடியாக, பொன்மங்களுடனான பணிகள் விரைவில் வெண்கலம், பித்தளை போன்ற பொன்மக் கலவைகளை உருவாக்க, கிமு 4000 ஆண்டளவில், வழிவகுத்தது .",Tamil
எஃகு போன்ற இரும்புக்கலவைகளின் பயன்பாடு கிமு 1800 ஆண்டளவில் இயன்றது.,Tamil
"भारत (आधिकारिक नाम: भारत गणराज्य, अंग्रेज़ी: Republic of India, लिप्यन्तरण: रिपब्लिक ऑफ़ इंडिया) दक्षिण एशिया में स्थित भारतीय उपमहाद्वीप का सबसे बड़ा देश है।",Hindi
"भारत भौगोलिक दृष्टि से विश्व का सातवाँ सबसे बड़ा देश है, जबकि जनसंख्या के दृष्टिकोण से दुनिया का सबसे बड़ा देश है।",Hindi
"भारत के पश्चिम में पाकिस्तान, उत्तर पश्चिम में अफगानिस्तान, उत्तर-पूर्व में चीन, नेपाल और भूटान, पूर्व में बांग्लादेश और म्यान्मार स्थित हैं।",Hindi
"हिंद महासागर में इसके दक्षिण पश्चिम में मालदीव, दक्षिण में श्रीलंका और दक्षिण-पूर्व में इंडोनेशिया से भारत की सामुद्रिक सीमा लगती है।",Hindi
इसके उत्तर में हिमालय पर्वत तथा दक्षिण में भारतीय महासागर स्थित है।,Hindi
दक्षिण-पूर्व में बंगाल की खाड़ी तथा पश्चिम में अरब सागर है।,Hindi
"1,200 ईसा पूर्व संस्कृत भाषा संपूर्ण भारतीय उपमहाद्वीप में फैली हुए थी और तब तक यहां पर हिंदू धर्म का उद्धव हो चुका था और ऋग्वेद की रचना भी हो चुकी थी।",Hindi
इसी समय बौद्ध एवं जैन धर्म उत्पन्न हो रहे होते थे।,Hindi
प्रारंभिक राजनीतिक एकत्रीकरण ने गंगा बेसिन में स्थित मौर्य और गुप्त साम्राज्यों को जन्म दिया।,Hindi
उनका समाज विस्तृत सृजनशीलता से भरा हुआ था।,Hindi
"प्रारंभिक मध्ययुगीन काल में, ईसाई धर्म, इस्लाम, यहूदी धर्म और पारसी धर्म ने भारत के दक्षिणी और पश्चिमी तटों पर जड़ें जमा लीं।",Hindi
"मध्य एशिया से मुस्लिम सेनाओं ने भारत के उत्तरी मैदानों पर लगातार अत्याचार किया, अंततः दिल्ली सल्तनत की स्थापना हुई और उत्तर भारत को मध्यकालीन इस्लाम साम्राज्य में मिला लिया गया।",Hindi
"15 वीं शताब्दी में, विजयनगर साम्राज्य ने दक्षिण भारत में एक लंबे समय तक चलने वाली समग्र हिंदू संस्कृति बनाई।",Hindi
पंजाब में सिख धर्म की स्थापना हुई।,Hindi
"धीरे-धीरे ब्रिटिश ईस्ट इंडिया कंपनी के शासन का विस्तार हुआ, जिसने भारत को औपनिवेशिक अर्थव्यवस्था में बदल दिया तथा अपनी संप्रभुता को भी मज़बूत किया।",Hindi
ब्रिटिश राज शासन १८५८ में शुरू हुआ।,Hindi
धीरे धीरे एक प्रभावशाली राष्ट्रवादी आंदोलन शुरू हुआ जिसे अहिंसक विरोध के लिए जाना गया और ब्रिटिश शासन को समाप्त करने का प्रमुख कारक बन गया।,Hindi
"1947 में ब्रिटिश भारतीय साम्राज्य को दो स्वतंत्र प्रभुत्वों में विभाजित किया गया, भारतीय अधिराज्य तथा पाकिस्तान अधिराज्य, जिन्हें धर्म के आधार पर विभाजित किया गया।",Hindi
1950 से भारत एक संघीय गणराज्य है।,Hindi
"भारत की जनसंख्या 1951 में 36.1 करोड़ से बढ़कर 2011 में‌ 121.1 करोड़, 2021 में बढ़कर 140.76 करोड़ हो गई।",Hindi
