text,language
"Technology is the application of conceptual knowledge to achieve practical goals, especially in a reproducible way.",English
"The word technology can also mean the products resulting from such efforts, including both tangible tools such as utensils or machines, and intangible ones such as software.",English
"Technology plays a critical role in science, engineering, and everyday life.",English
Technological advancements have led to significant changes in society.,English
The invention of the wheel in the Bronze Age allowed greater travel and the creation of more complex machines.,English
"More recent technological inventions, including the printing press, telephone, and the Internet, have lowered barriers to communication and ushered in the knowledge economy.",English
"As a result, philosophical and political debates about the role and use of technology, the ethics of technology, and ways to mitigate its downsides are ongoing.",English
"It is predated in use by the Ancient Greek word τέχνη (tékhnē), used to mean 'knowledge of how to make things', which encompassed activities like architecture.",English
"The term was previously uncommon in English and mostly referred to the academic discipline, as in the Massachusetts Institute of Technology.",English
History Prehistoric Tools were initially developed by hominids through observation and trial and error.,English
"Around 2 Mya (million years ago), they learned to make the first stone tools by hammering flakes off a pebble, forming a sharp hand axe.",English
"This practice was refined 75 kya (thousand years ago) into pressure flaking, enabling much finer work.",English
"The discovery of fire was described by Charles Darwin as ""possibly the greatest ever made by man"".",English
"Archaeological, dietary, and social evidence point to ""continuous [human] fire-use"" at least 1.5 Mya.",English
"Fire, fueled with wood and charcoal, allowed early humans to cook their food to increase its digestibility, improving its nutrient value and broadening the number of foods that could be eaten.",English
"The cooking hypothesis proposes that the ability to cook promoted an increase in hominid brain size, though some researchers find the evidence inconclusive.",English
Archaeological evidence of hearths was dated to 790 kya; researchers believe this is likely to have intensified human socialization and may have contributed to the emergence of language.,English
Other technological advances made during the Paleolithic era include clothing and shelter.,English
"No consensus exists on the approximate time of adoption of either technology, but archaeologists have found archaeological evidence of clothing 90-120 kya and shelter 450 kya.",English
"As the Paleolithic era progressed, dwellings became more sophisticated and more elaborate; as early as 380 kya, humans were constructing temporary wood huts.",English
"Clothing, adapted from the fur and hides of hunted animals, helped humanity expand into colder regions; humans began to migrate out of Africa around 200 kya, initially moving to Eurasia.",English
"Neolithic The Neolithic Revolution (or First Agricultural Revolution) brought about an acceleration of technological innovation, and a consequent increase in social complexity.",English
The invention of the polished stone axe was a major advance that allowed large-scale forest clearance and farming.,English
This use of polished stone axes increased greatly in the Neolithic but was originally used in the preceding Mesolithic in some areas such as Ireland.,English
"Agriculture fed larger populations, and the transition to sedentism allowed for the simultaneous raising of more children, as infants no longer needed to be carried around by nomads.",English
"Additionally, children could contribute labor to the raising of crops more readily than they could participate in hunter-gatherer activities.",English
With this increase in population and availability of labor came an increase in labor specialization.,English
"The invention of writing led to the spread of cultural knowledge and became the basis for history, libraries, schools, and scientific research.",English
"The advantages of copper tools over stone, bone and wooden tools were quickly apparent to early humans, and native copper was probably used from near the beginning of Neolithic times (about 10 kya).",English
"Native copper does not naturally occur in large amounts, but copper ores are quite common and some of them produce metal easily when burned in wood or charcoal fires.",English
"Eventually, the working of metals led to the discovery of alloys such as bronze and brass (about 4,000 BCE).",English
"The first use of iron alloys such as steel dates to around 1,800 BCE.",English
"Ancient After harnessing fire, humans discovered other forms of energy.",English
"The earliest known use of wind power is the sailing ship; the earliest record of a ship under sail is that of a Nile boat dating to around 7,000 BCE.",English
The ancient Sumerians in Mesopotamia used a complex system of canals and levees to divert water from the Tigris and Euphrates rivers for irrigation.,English
"Archaeologists estimate that the wheel was invented independently and concurrently in Mesopotamia (in present-day Iraq), the Northern Caucasus (Maykop culture), and Central Europe.",English
"Time estimates range from 5,500 to 3,000 BCE with most experts putting it closer to 4,000 BCE.",English
"The oldest artifacts with drawings depicting wheeled carts date from about 3,500 BCE.",English
The invention of the wheel revolutionized trade and war.,English
It did not take long to discover that wheeled wagons could be used to carry heavy loads.,English
The ancient Sumerians used a potter's wheel and may have invented it.,English
"A stone pottery wheel found in the city-state of Ur dates to around 3,429 BCE, and even older fragments of wheel-thrown pottery have been found in the same area.",English
"The first two-wheeled carts were derived from travois and were first used in Mesopotamia and Iran in around 3,000 BCE.",English
"The first long-distance road, which came into use around 3,500 BCE, spanned 2,400 km from the Persian Gulf to the Mediterranean Sea, but was not paved and was only partially maintained.",English
"Unlike the earlier road, the Minoan road was completely paved.",English
Ancient Minoan private homes had running water.,English
A bathtub virtually identical to modern ones was unearthed at the Palace of Knossos.,English
"Several Minoan private homes also had toilets, which could be flushed by pouring water down the drain.",English
"The ancient Romans had many public flush toilets, which emptied into an extensive sewage system.",English
The primary sewer in Rome was the Cloaca Maxima; construction began on it in the sixth century BCE and it is still in use today.,English
"The ancient Romans also had a complex system of aqueducts, which were used to transport water across long distances.",English
The first Roman aqueduct was built in 312 BCE.,English
The eleventh and final ancient Roman aqueduct was built in 226 CE.,English
"Put together, the Roman aqueducts extended over 450 km, but less than 70 km of this was above ground and supported by arches.",English
"Pre-modern Innovations continued through the Middle Ages with the introduction of silk production (in Asia and later Europe), the horse collar, and horseshoes.",English
"Simple machines (such as the lever, the screw, and the pulley) were combined into more complicated tools, such as the wheelbarrow, windmills, and clocks.",English
"A system of universities developed and spread scientific ideas and practices, including Oxford and Cambridge.",English
"The Renaissance era produced many innovations, including the introduction of the movable type printing press to Europe, which facilitated the communication of knowledge.",English
"Technology became increasingly influenced by science, beginning a cycle of mutual advancement.",English
"This was followed a century later by the Second Industrial Revolution which led to rapid scientific discovery, standardization, and mass production.",English
"New technologies were developed, including sewage systems, electricity, light bulbs, electric motors, railroads, automobiles, and airplanes.",English
"These technological advances led to significant developments in medicine, chemistry, physics, and engineering.",English
"They were accompanied by consequential social change, with the introduction of skyscrapers accompanied by rapid urbanization.",English
"Communication improved with the invention of the telegraph, the telephone, the radio, and television.",English
The 20th century brought a host of innovations.,English
"In physics, the discovery of nuclear fission in the Atomic Age led to both nuclear weapons and nuclear power.",English
Analog computers were invented and asserted dominance in processing complex data.,English
"Information technology, particularly optical fiber and optical amplifiers, allowed for simple and fast long-distance communication, which ushered in the Information Age and the birth of the Internet.",English
"The Space Age began with the launch of Sputnik 1 in 1957, and later the launch of crewed missions to the moon in the 1960s.",English
"Organized efforts to search for extraterrestrial intelligence have used radio telescopes to detect signs of technology use, or technosignatures, given off by alien civilizations.",English
"Modern technology increasingly relies on training and education – their designers, builders, maintainers, and users often require sophisticated general and specific training.",English
Impact Technological change is the largest cause of long-term economic growth.,English
"Throughout human history, energy production was the main constraint on economic development, and new technologies allowed humans to significantly increase the amount of available energy.",English
"First came fire, which made edible a wider variety of foods, and made it less physically demanding to digest them.",English
"Fire also enabled smelting, and the use of tin, copper, and iron tools, used for hunting or tradesmanship.",English
"Recent years have brought about a rise in social media's cultural prominence, with potential repercussions on democracy, and economic and social life.",English
"Early on, the internet was seen as a ""liberation technology"" that would democratize knowledge, improve access to education, and promote democracy.",English
"Modern research has turned to investigate the internet's downsides, including disinformation, polarization, hate speech, and propaganda.",English
"Since the 1970s, technology's impact on the environment has been criticized, leading to a surge in investment in solar, wind, and other forms of clean energy.",English
"Social Jobs Since the invention of the wheel, technologies have helped increase humans' economic output.",English
Studies have found that computers did not create significant net technological unemployment.,English
A 2017 survey found no clear consensus among economists on whether AI would increase long-term unemployment.,English
"According to the World Economic Forum's ""The Future of Jobs Report 2020"", AI is predicted to replace 85 million jobs worldwide, and create 97 million new jobs by 2025.",English
"From 1990 to 2007, a study in the U.S.",English
"by MIT economist Daron Acemoglu showed that an addition of one robot for every 1,000 workers decreased the employment-to-population ratio by 0.2%, or about 3.3 workers, and lowered wages by 0.42%.",English
Concerns about technology replacing human labor however are long-lasting.,English
"Security With the growing reliance of technology, there have been security and privacy concerns along with it.",English
"Billions of people use different online payment methods, such as WeChat Pay, PayPal, Alipay, and much more to help transfer money.",English
"Although security measures are placed, some criminals are able to bypass them.",English
"Because of this, the U.S.",English
"Treasury Department sanctioned Blender.io, which marked the first time it has taken action against a mixer, to try to crack down on North Korean hackers.",English
The privacy of cryptocurrency has been debated.,English
"Although many customers like the privacy of cryptocurrency, many also argue that it needs more transparency and stability.",English
Environmental Technology can have both positive and negative effects on the environment.,English
"Environmental technology, describes an array of technologies which seek to reverse, mitigate or halt environmental damage to the environment.",English
"This can include measures to halt pollution through environmental regulations, capture and storage of pollution, or using pollutant byproducts in other industries.",English
Other examples of environmental technology include deforestation and the reversing of deforestation.,English
"Emerging technologies in the fields of climate engineering may be able to halt or reverse global warming and its environmental impacts, although this remains highly controversial.",English
"This continues to gradually heat the earth, causing global warming and climate change.",English
Measures of technological innovation correlates with a rise in greenhouse gas emissions.,English
ಟೆಕ್ನಾಲಜೀಸ್ ಗಮನಾರ್ಹವಾಗಿ ಮಾನವ ಹಾಗೆಯೇ ನಿಯಂತ್ರಿಸಲು ಮತ್ತು ನೈಸರ್ಗಿಕ ಪರಿಸರಗಳಲ್ಲಿ ಅವುಗಳ ಹೊoದಿಕೊಳ್ಳುವ ಇತರ ಪ್ರಾಣಿಗಳ ಜಾತಿಗಳ ' ಸಾಮರ್ಥ್ಯದ ಮೇಲೆ ಪರಿಣಾಮ.,Kannada
"ಪದ ಸಾಮಾನ್ಯವಾಗಿ ಅಥವಾ ನಿರ್ದಿಷ್ಟ ಪ್ರದೇಶಗಳಿಗೆ ಅನ್ವಯಿಸಬಹುದು: ಉದಾಹರಣೆಗಳು ನಿರ್ಮಾಣ ತಂತ್ರಜ್ಞಾನ, ವೈದ್ಯಕೀಯ ತಂತ್ರಜ್ಞಾನ, ಮತ್ತು ಮಾಹಿತಿ ತಂತ್ರಜ್ಞಾನ.",Kannada
ತಂತ್ರಜ್ಞಾನದ ಮಾನವ ಜಾತಿಯ ' ಬಳಕೆ ಸರಳ ಉಪಕರಣಗಳ ಒಳಗೆ ನೈಸರ್ಗಿಕ ಸಂಪನ್ಮೂಲಗಳ ಪರಿವರ್ತನೆ ಆರಂಭವಾಯಿತು.,Kannada
ಬೆಂಕಿ ನಿಯಂತ್ರಿಸಲು ಸಾಮರ್ಥ್ಯದ ಆವಿಷ್ಕಾರ ಆಹಾರ ಮೂಲಗಳು ಹೆಚ್ಚಿದ ಮತ್ತು ಚಕ್ರದ ಆವಿಷ್ಕಾರ ಪ್ರಯಾಣಿಸುತ್ತಿದ್ದ ಮತ್ತು ತಮ್ಮ ಪರಿಸರವನ್ನು ನಿಯಂತ್ರಿಸುವಲ್ಲಿ ಮಾನವರಿಗೆ ನೆರವಾಯಿತು.,Kannada
"ಮುದ್ರಣ, ದೂರವಾಣಿ, ಅಂತರಜಾಲ ಸೇರಿದಂತೆ ಇತ್ತೀಚಿನ ತಾಂತ್ರಿಕ ಬೆಳವಣಿಗೆಗಳು, ಸಂವಹನ ದೈಹಿಕ ತಡೆ ಕುಗ್ಗಿದೆ ಮತ್ತು ಮಾನವರು ಜಾಗತಿಕ ಮಟ್ಟದಲ್ಲಿ ಮುಕ್ತವಾಗಿ ವ್ಯವಹರಿಸಲು ಅವಕಾಶವಾಗಿದೆ.",Kannada
ಹೆಚ್ಚಿನ ಸಮಾಜಗಳಲ್ಲಿ ತಂತ್ರಜ್ಞಾನ ( ಇಂದಿನ ಜಾಗತಿಕ ಆರ್ಥಿಕ ಸೇರಿದಂತೆ ) ಹೆಚ್ಚು ಸುಧಾರಿತ ಆರ್ಥಿಕ ಅಭಿವೃದ್ಧಿಗೆ ಸಹಾಯ ಮತ್ತು ಒಂದು ವಿರಾಮ ವರ್ಗದ ಏರಿಕೆ ಅವಕಾಶ ಕಲ್ಪಿಸಿತು.,Kannada
"ಅನೇಕ ತಾಂತ್ರಿಕ ಪ್ರಕ್ರಿಯೆಗಳು ಮಾಲಿನ್ಯ ಎಂದು, ಉತ್ಪನ್ನಗಳು ಅನಗತ್ಯ ಉತ್ಪತ್ತಿ, ಮತ್ತು ಭೂಮಿಯ ವಾತಾವರಣದ ವಿನಾಶವು, ನೈಸರ್ಗಿಕ ಸಂಪನ್ಮೂಲಗಳು ಖಾಲಿಯಾಗುತ್ತದೆ.",Kannada
ತಂತ್ರಜ್ಞಾನ ಪ್ರಭಾವ ಸಮಾಜದ ಮತ್ತು ಹೊಸ ತಂತ್ರಜ್ಞಾನದ ಮೌಲ್ಯಗಳ ವಿವಿಧ ಅನುಷ್ಠಾನಗಳನ್ನು ಸಾಮಾನ್ಯವಾಗಿ ಹೊಸ ನೈತಿಕ ಪ್ರಶ್ನೆಗಳನ್ನು ಹುಟ್ಟುಹಾಕುತ್ತದೆ.,Kannada
"ಉದಾಹರಣೆಗಳು ಮಾನವ ಉತ್ಪಾದಕತೆ ವಿಷಯದಲ್ಲಿ ದಕ್ಷತೆ ಕಲ್ಪನೆ ಏರಿಕೆ ಸೇರಿವೆ, ಒಂದು ಪದವನ್ನು ಮೂಲತಃ ಯಂತ್ರಗಳು ಮಾತ್ರ ಅನ್ವಯಿಸುತ್ತದೆ, ಮತ್ತು ಸಾಂಪ್ರದಾಯಿಕ ಸೂತ್ರಗಳ ಸವಾಲು.",Kannada
] ಫಿಲಾಸಫಿಕಲ್ ಚರ್ಚೆಗಳು ತಂತ್ರಜ್ಞಾನ ಮಾನವ ಪರಿಸ್ಥಿತಿ ಸುಧಾರಿಸುತ್ತದೆ ಅಥವಾ ಹಾಳಾಗುತ್ತದೆ ಎಂಬುದರ ನಡುವೆ ತೀವ್ರ ಭಿನ್ನಾಭಿಪ್ರಾಯಗಳ ಸಮಾಜದಲ್ಲಿ ತಂತ್ರಜ್ಞಾನ ಪ್ರಸ್ತುತ ಮತ್ತು ಭವಿಷ್ಯದ ಬಳಕೆಗಾಗಿ ಮೇಲೆ ಹುಟ್ಟಿಕೊoಡಿವೆ.,Kannada
"ತಂತ್ರಜ್ಞಾನ ಸಂಸ್ಕೃತಿಯ ರೂಪಗಳು ಅಥವಾ ಬದಲಾಯಿಸುತ್ತದೆ ಚಟುವಟಿಕೆ ನೋಡಬಹುದು.ಹೆಚ್ಚುವರಿಯಾಗಿ, ತಂತ್ರಜ್ಞಾನ ಇದನ್ನು ಕರೆಯುತ್ತಾರೆ ಎಂದು ಜೀವನದ ಪ್ರಯೋಜನಕ್ಕಾಗಿ ಗಣಿತ, ವಿಜ್ಞಾನ, ಕಲೆ ಮತ್ತು ಅಪ್ಲಿಕೇಶನ್ ಆಗಿದೆ.",Kannada
"ಆಧುನಿಕ ಉದಾಹರಣೆಗೆ ಮಾನವ ಪರಸ್ಪರ ತಡೆ ಕಡಿಮೆಯಾಗಿದೆ ಮತ್ತು, ಪರಿಣಾಮವಾಗಿ, ಸ್ಪಾವ್ನ್ ಹೊಸ ಉಪಸಂಸ್ಕೃತಿಗಳ ಸಹಾಯ ಇದು ಸಂವಹನ ತಂತ್ರಜ್ಞಾನ, ಏರಿಕೆ;.",Kannada
"ಸಾಂಸ್ಕೃತಿಕ ಚಟುವಟಿಕೆ, ತಂತ್ರಜ್ಞಾನ ತಾಂತ್ರಿಕ ಪ್ರಯತ್ನದ ಕೆಲವು ಅಂಶಗಳನ್ನು ಅಧಿಕೃತಗೊಳಿಸಲು ಪ್ರತಿಯೊoದು, ವಿಜ್ಞಾನ ಮತ್ತು ಎಂಜಿನಿಯರಿಂಗ್ ಎರಡೂ ಮೂಡಿರುತ್ತದೆ.",Kannada
"ವಿಜ್ಞಾನ, ಎಂಜಿನಿಯರಿಂಗ್ ಮತ್ತು ತಂತ್ರಜ್ಞಾನದ ನಡುವಿನ ವ್ಯತ್ಯಾಸವು ಯಾವಾಗಲೂ ಸ್ಪಷ್ಟವಾಗಿಲ್ಲ.",Kannada
"ವಿಜ್ಞಾನ ವೈಜ್ಞಾನಿಕ ವಿಧಾನ ಫಾರ್ಮಲ್ ತಂತ್ರಗಳನ್ನು ಬಳಸಿಕೊಳ್ಳುತ್ತಿದೆ ಲೋಕೋತ್ತರ ಪ್ರಪಂಚದ ಅಂಶಗಳ ನಡುವೆ ನಿರಂತರ ತತ್ವಗಳನ್ನು ಪತ್ತೆಹಚ್ಚಿದ ಗುರಿಯನ್ನು ಸಮರ್ಥನೆಯ ತನಿಖೆ ಅಥವಾ ವಿದ್ಯಮಾನಗಳ ಅಧ್ಯಯನದಲ್ಲಿ, ಆಗಿದೆ.",Kannada
"ಅವರು ಅಗತ್ಯಗಳನ್ನು ಪೂರೈಸಲು ಏಕೆಂದರೆ  ಟೆಕ್ನಾಲಜೀಸ್, ಸಾಮಾನ್ಯವಾಗಿ ಪ್ರತ್ಯೇಕವಾಗಿ ವಿಜ್ಞಾನದ ಉತ್ಪನ್ನಗಳು ಅಲ್ಲ ಇಂತಹ ಉಪಯುಕ್ತತೆಯನ್ನು, ಉಪಯುಕ್ತತೆ ಮತ್ತು ಸುರಕ್ಷತೆ ಮಾಹಿತಿ.",Kannada
"ತಂತ್ರಜ್ಞಾನದ ಅಭಿವೃದ್ಧಿಗೆ ಕೆಲವು ಪ್ರಾಯೋಗಿಕ ಪರಿಣಾಮವಾಗಿ ಸಾಧಿಸಲು, ವೈಜ್ಞಾನಿಕ, ಎಂಜಿನಿಯರಿಂಗ್, ಗಣಿತ, ಭಾಷಾ, ಮತ್ತು ಐತಿಹಾಸಿಕ ಜ್ಞಾನ ಸೇರಿದಂತೆ ಜ್ಞಾನದ ಹಲವು ಕ್ಷೇತ್ರಗಳಲ್ಲಿ ಮೇಲೆ ಸೆಳೆಯಲು.",Kannada
ತಂತ್ರಜ್ಞಾನ ಸಾಮಾನ್ಯವಾಗಿ ವಿಜ್ಞಾನ ಮತ್ತು ಎಂಜಿನಿಯರಿಂಗ್ ಪರಿಣಾಮವಾಗಿದೆ - ಒಂದು ಮಾನವ ಚಟುವಟಿಕೆ ತಂತ್ರಜ್ಞಾನ ಎರಡು ಜಾಗ ಮುಂಚಿತವಾಗಿ ಆದರೂ.,Kannada
"ಉದಾಹರಣೆಗೆ, ವಿಜ್ಞಾನ ಈಗಾಗಲೇ ಅಸ್ತಿತ್ವದಲ್ಲಿರುವ ಉಪಕರಣಗಳು ಮತ್ತು ಜ್ಞಾನ ಬಳಸಿ, ವಿದ್ಯುತ್ ವಾಹಕಗಳು ಎಲೆಕ್ಟ್ರಾನ್ಗಳ ಹರಿವು ತಿಳಿಯಬಹುದು.",Kannada
"ಈ ಹೊಸ ಜ್ಞಾನ ಇಂತಹ ಕಂಪ್ಯೂಟರ್ಗಳು, ಮತ್ತು ಸುಧಾರಿತ ತಂತ್ರಜ್ಞಾನದ ಇತರ ಮಾದರಿಗಳಂತೆ ಹೊಸ ಉಪಕರಣಗಳು ಮತ್ತು ಯಂತ್ರಗಳು, ರಚಿಸಲು ಎಂಜಿನಿಯರ್ಗಳು ಬಳಸಬಹುದು.",Kannada
"ಈ ಅರ್ಥದಲ್ಲಿ, ವಿಜ್ಞಾನಿಗಳು ಮತ್ತು ಎಂಜಿನಿಯರುಗಳು ಎರಡೂ ತಂತ್ರಜ್ಞರು ಪರಿಗಣಿಸಲಾಗುತ್ತದೆ; ಮೂರು ಜಾಗ ಸಾಮಾನ್ಯವಾಗಿ ಸಂಶೋಧನೆ ಮತ್ತು ಉಲ್ಲೇಖ ಉದ್ದೇಶಗಳಿಗಾಗಿ ಒಂದೆಂದು ಪರಿಗಣಿಸಲಾಗಿದೆ .",Kannada
ಈ ಅಗತ್ಯ ಹೊಸ ಜ್ಞಾನ ಮಾತ್ರ ಮೂಲಭೂತ ವೈಜ್ಞಾನಿಕ ಸಂಶೋಧನೆ ಮೂಲಕ ಪಡೆಯಬಹುದು.,Kannada
""" 1960 ರಲ್ಲಿ, ಆದರೆ, ಈ ನೋಟ ನಿರ್ದಿಷ್ಟ ಕಾರ್ಯಗಳನ್ನು ( ವೈಜ್ಞಾನಿಕ ಸಮುದಾಯವು ಪ್ರತಿರೋಧವನ್ನು ಉಪಕ್ರಮಗಳು ) ವಿಜ್ಞಾನ ನಿಧಿಯನ್ನು ಉಪಕ್ರಮಗಳು ಕಡೆಗೆ ಪ್ರಮುಖ, ನೇರ ದಾಳಿ ಒಳಪಟ್ಟಿತು.",Kannada
ಸಮಸ್ಯೆಯನ್ನು ವಿವಾದಾಸ್ಪದ ಆದರೂ ಉಳಿದಿದೆ ಹೆಚ್ಚಿನ ವಿಶ್ಲೇಷಕರು ತಂತ್ರಜ್ಞಾನ ಕೇವಲ ವೈಜ್ಞಾನಿಕ ಸಂಶೋಧನೆಯ ಪರಿಣಾಮವಾಗಿ ಮಾದರಿ ವಿರೋಧಿಸಲು.,Kannada
1983 ರಲ್ಲಿ ಒಂದು ಜಾಹಿರಾತನ್ನು ಪ್ರೋಗ್ರಾಂ ಅಮೇರಿಕಾದ ಕುಸಿಯುತ್ತಿರುವ ಆರ್ಥಿಕ ಮತ್ತು ಮಿಲಿಟರಿ ಸ್ಪರ್ಧಾತ್ಮಕತೆಯನ್ನು ರಿವರ್ಸ್ ಅಮೇರಿಕಾದ ಗುಪ್ತಚರ ಸಮುದಾಯ ಆರಂಭಿಸಲಾಯಿತು.,Kannada
"ಪ್ರೋಗ್ರಾಂ, ಪ್ರಾಜೆಕ್ಟ್ ಸಾಕ್ರಟೀಸ್, ಅಮೇರಿಕಾದ ಕುಸಿತದ ಮೂಲ ನಿರ್ಧರಿಸಲು ಸ್ಪರ್ಧೆಯಲ್ಲಿ ಎಲ್ಲಾ ರೂಪಗಳನ್ನು ಪ್ರಪಂಚದಾದ್ಯಂತ ಸ್ಪರ್ಧಾತ್ಮಕತೆಯನ್ನು ಪರಿಶೀಲಿಸಲು ಎಲ್ಲಾ ಮೂಲ ಗುಪ್ತಚರ ಬಳಸಲಾಗುತ್ತದೆ.",Kannada
ತಂತ್ರಜ್ಞಾನ ಸರಿಯಾಗಿ ಒಂದು ಕಾರ್ಯ ಸಾಧಿಸಲು ವಿಜ್ಞಾನದ ಯಾವುದೇ ಅನ್ವಯಿಸುವಿಕೆ ಎಂದು ಉಲ್ಲೇಖಿಸಲ್ಪಡುತ್ತದೆ.,Kannada
"ವಿಜ್ಞಾನ ಮುಂಚೂಣಿಯಲ್ಲಿ ಅಥವಾ ಸುವ್ಯವಸ್ಥಿತ ಮತ್ತು ಕಾರ್ಯ ಹೆಚ್ಚಿನ ಗೋಚರತೆಯನ್ನು ಅಥವಾ ಗಮನಾರ್ಹವಾಗಿ ಹೆಚ್ಚು ಪ್ರಾಪಂಚಿಕ ಇರಬಹುದು ಆದರೆ ಎಲ್ಲಾ ತಂತ್ರಜ್ಞಾನ, ಮತ್ತು ಅದರ ನಿಂದನೆ ಎಲ್ಲಾ ಸ್ಪರ್ಧಾತ್ಮಕ ಲಾಭವನ್ನು ಬುನಾದಿ ಮಾಡಬಹುದು.",Kannada
"ತಂತ್ರಜ್ಞಾನ ಆಧಾರಿತ ಯೋಜನೆ ಎರಡನೇ ( ಉದಾ, ಡೌ, ಡ್ಯುಪಾಂಟ್, ಜಿಎಂ ) ಮೊದಲು ಅಮೇರಿಕಾದ ಕೈಗಾರಿಕಾ ದೈತ್ಯರು ನಿರ್ಮಿಸಲು ಬಳಸಲಾಯಿತು ಏನು ಮತ್ತು ಒಂದು ಮಹಾಶಕ್ತಿ ಒಳಗೆ ಅಮೇರಿಕಾದ ರೂಪಾಂತರ ಬಳಸಲಾಯಿತು ಇದು.",Kannada
ಇದು ಆರ್ಥಿಕ ಮೂಲದ ಯೋಜನೆ ಅಲ್ಲ.,Kannada
"ಪ್ರಾಜೆಕ್ಟ್ ಸಾಕ್ರಟೀಸ್ ಅಮೇರಿಕಾದ ಸ್ಪರ್ಧಾತ್ಮಕತೆಯನ್ನು ಪುನರ್ ನಿರ್ಧರಿಸುತ್ತದೆ, ಅಮೇರಿಕಾದ ಉದ್ದಕ್ಕೂ ನಿರ್ಧಾರ ತಂತ್ರಜ್ಞಾನ ಆಧಾರಿತ ಯೋಜನೆ ಪುನಃ ಆರಿಸು ಹೊoದಿತ್ತು.",Kannada
ಅಮೇರಿಕಾದ ಸ್ಪರ್ಧಾತ್ಮಕತೆಯನ್ನು ಚೀನಾ ಮತ್ತು ಭಾರತಗಳ ಬಳಸಿದ ಹೆಚ್ಚು ಮುಂದುವರಿದ ಎಂದು ತಂತ್ರಜ್ಞಾನ ಆಧಾರಿತ ಯೋಜನೆ ಒಂದು ರೂಪ ಅಳವಡಿಸಿಕೊಳ್ಳಲು ಬೇಕಾದ ಅಮೇರಿಕಾದ ನಿರ್ಧಾರ ತಯಾರಕರು ಮರುನಿರ್ಮಾಣಕ್ಕೆ.,Kannada
